{
  "schema_version": "1",
  "finding_id": "fnd_00000000000000000002",
  "subject": {
    "adapter_id": "refdest-c2",
    "destination_ref": "dest_oob_0031"
  },
  "adapter_id": "refdest-c2",
  "classification": "ORPHANED",
  "evidence_digest": "sha256:eeeeeeeeeeeeeeeeeeeeeeeeeeeeeeeeeeeeeeeeeeeeeeeeeeeeeeeeeeeeeeee",
  "evidence": {
    "digest": "sha256:eeeeeeeeeeeeeeeeeeeeeeeeeeeeeeeeeeeeeeeeeeeeeeeeeeeeeeeeeeeeeeee",
    "bundle": null,
    "redaction": "digest_only"
  },
  "created_by": "sweep",
  "created_at": "2026-07-21T11:00:00Z",
  "resolution": { "status": "OPEN" }
}
